{
  "protocol_version": "1.0",
  "message_id": "d5c0a3c6-110f-4728-ae22-20435055e193",
  "kind": "event",
  "name": "transcript.final",
  "sent_at": "2026-08-23T21:31:04Z",
  "instance_id": "e68d1332-90e0-4378-a887-7f4ef69c81a2",
  "sequence": 6,
  "payload": {
    "session_id": "1ecda715-bd79-43b4-b187-4cf859b20001",
    "raw_text": "teste de input por audio",
    "processed_text": "Teste de input por áudio.",
    "output_text": "Teste de input por áudio.",
    "post_processed": true,
    "prompt_rewritten": false,
    "insertion": { "status": "inserted", "method": "keyboard" },
    "transcription_backend": "local-whisper",
    "language": "pt",
    "duration_ms": 3210
  }
}
