{
  "protocol_version": "1.0",
  "message_id": "d6c8c1af-ad48-4619-bac0-3833503d8792",
  "kind": "response",
  "name": "settings.replace",
  "sent_at": "2026-08-23T21:32:00Z",
  "correlation_id": "abbb975b-58e3-41ea-98c8-a237425524df",
  "instance_id": "e68d1332-90e0-4378-a887-7f4ef69c81a2",
  "payload": {},
  "error": {
    "code": "conflict",
    "message": "Settings changed since revision 3",
    "retryable": true,
    "details": { "expected_revision": 3, "current_revision": 4 }
  }
}
