{
  "protocol_version": "1.0",
  "message_id": "3d98ee46-b0d3-4a3a-99bb-f8cdd0304dbd",
  "kind": "event",
  "name": "transcript.partial",
  "sent_at": "2026-08-23T21:31:02Z",
  "instance_id": "e68d1332-90e0-4378-a887-7f4ef69c81a2",
  "sequence": 3,
  "payload": {
    "session_id": "1ecda715-bd79-43b4-b187-4cf859b20001",
    "text": "teste de input"
  }
}
