{
  "protocol_version": "1.0",
  "message_id": "9e5ed66f-f441-446b-96dd-a65a80dcc35e",
  "kind": "response",
  "name": "credentials.put",
  "sent_at": "2026-08-23T21:31:10Z",
  "correlation_id": "ef6f7822-9e1d-4d87-9d56-53db352298b6",
  "instance_id": "e68d1332-90e0-4378-a887-7f4ef69c81a2",
  "payload": {
    "credential_id": "cleanup-provider",
    "stored": true
  }
}
