{
  "protocol_version": "1.0",
  "message_id": "ad98dc00-f97d-4eb2-a39b-1db719cbe53b",
  "kind": "event",
  "name": "recording.level",
  "sent_at": "2026-08-23T21:31:01Z",
  "instance_id": "e68d1332-90e0-4378-a887-7f4ef69c81a2",
  "sequence": 2,
  "payload": {
    "session_id": "1ecda715-bd79-43b4-b187-4cf859b20001",
    "level": 0.42
  }
}
