{
  "protocol_version": "1.0",
  "message_id": "ef6f7822-9e1d-4d87-9d56-53db352298b6",
  "kind": "request",
  "name": "credentials.put",
  "sent_at": "2026-08-23T21:31:10Z",
  "instance_id": "e68d1332-90e0-4378-a887-7f4ef69c81a2",
  "payload": {
    "credential_id": "cleanup-provider",
    "secret": "fixture-not-a-real-secret"
  }
}
